{
  "capabilities": [
    "coding",
    "google-chat"
  ],
  "runtime_kind": "gemini-cli",
  "cli": {
    "binPath": "%USERPROFILE%\\AppData\\Roaming\\npm\\gemini.ps1",
    "command": "gemini",
    "version": "0.55.1",
    "invoke": "gemini -p {prompt}"
  },
  "agent_id": "gemini",
  "preflight": "派单需 full-access（自重启 spawn）；默认模型 gemini-3.5-flash 区域受限（403），需先换可用模型",
  "schema_version": 2,
  "observed_at": "2026-10-21T06:01:22Z",
  "permissions": {
    "mode": "unknown",
    "calibration": "unknown",
    "evidence": "未校准（无 headless 权限实测）；P2-A 按只读降级，不授未证明的写权",
    "tool_allowlist": [],
    "denied_tools": [],
    "headless_allow_delegation": false,
    "approval_required": []
  },
  "kind": "coding-agent",
  "present": false,
  "invoke_contract": {
    "exit_code_semantics": {
      "0": "success",
      "non-zero": "failure"
    },
    "prompt_transport": "argv",
    "permission_flags": {},
    "output_format": "text"
  },
  "capability_boundary": {
    "workspace_read": "unknown",
    "shell_headless": "unknown",
    "workspace_write_headless": "unknown",
    "tool_loop": "yes",
    "network": "yes"
  },
  "model_info": {
    "value": null,
    "source": "unknown",
    "confidence": "unknown",
    "evidence": "配置文件不存在：%USERPROFILE%/.gemini/settings.json"
  }
}
